{
  "external_truth": {
    "system": "The observed SPEC.json revision and Git base commit",
    "desired_outcome": "Each enabled work item reaches verified Git state without giving authority to a fallible worker",
    "observation": "Read and hash SPEC.json, read the current Git commit, and read SQLite execution state before each comparison"
  },
  "normalized_work": {
    "identity_fields": [
      "work item id",
      "canonical work item digest for achieved-state identity",
      "full SPEC digest for active-run fencing",
      "base commit",
      "immutable promotion intent"
    ],
    "scheduling_fields": [
      "kind",
      "priority",
      "status",
      "attempt count",
      "controller lease generation",
      "controller lease expiration",
      "lease generation",
      "lease expiration",
      "self-improvement candidate limit",
      "self-improvement candidate process-time limit"
    ]
  },
  "domain_states": [
    {"name": "ready", "meaning": "The desired item is eligible for a bounded attempt"},
    {"name": "active", "meaning": "One current fenced run owns the item"},
    {"name": "achieved", "meaning": "A verified candidate was promoted for the observed canonical work-item revision"},
    {"name": "blocked", "meaning": "Policy or repeated failure prevents automatic progress"},
    {"name": "superseded", "meaning": "The current SPEC no longer requests the item"}
  ],
  "execution_states": [
    {"name": "leased", "meaning": "The controller created a fenced claim"},
    {"name": "executing", "meaning": "The agent can change only the isolated worktree"},
    {"name": "evaluating", "meaning": "Configured gates evaluate the candidate"},
    {"name": "promoting", "meaning": "Fresh reads passed, immutable intent is stored, and local promotion is in progress"},
    {"name": "awaiting-promotion", "meaning": "A verified candidate is in a stable manual-promotion handoff"},
    {"name": "succeeded", "meaning": "The verified candidate reached the base repository"},
    {"name": "failed", "meaning": "The attempt ended without semantic success"},
    {"name": "stale", "meaning": "Authority expired or observed desired state changed"}
  ],
  "ownership_failure_boundaries": [
    {
      "resource": "Controller ownership",
      "owner": "One current owner token and generation in the SQLite state database for the resolved base repository",
      "failure_domain": "Concurrent or restarted controllers can share a state database and base repository",
      "authority_loss_behavior": "Reject scheduling mutations and promotion unless the controller owner, repository, generation, and lease time are current"
    },
    {
      "resource": "Desired work",
      "owner": "SPEC.json at its observed full SHA-256 digest, with each item identified by its canonical SHA-256 digest",
      "failure_domain": "A worker can read but cannot redefine the requested outcome",
      "authority_loss_behavior": "Stop an active child, dispatch, evaluation, or promotion and mark the run stale"
    },
    {
      "resource": "Execution lease and evidence",
      "owner": "SQLite state store",
      "failure_domain": "A process exit or worker message cannot directly set semantic success",
      "authority_loss_behavior": "Stop an active child and reject the event unless the run id, generation, state, and lease are current"
    },
    {
      "resource": "Source state and promotion",
      "owner": "Git base repository and reconciler",
      "failure_domain": "The agent owns edits only in its worktree",
      "authority_loss_behavior": "Stop an active child, preserve the candidate, and refuse promotion after base movement"
    },
    {
      "resource": "Interrupted promotion",
      "owner": "Immutable SQLite intent, current SPEC, current Git base, and current replacement controller",
      "failure_domain": "Git can complete before SQLite success finalization",
      "authority_loss_behavior": "Finalize only the exact intended candidate under current SPEC authority; otherwise record refusal, preserve the worktree, and never overwrite Git"
    },
    {
      "resource": "Self-improvement quality evidence",
      "owner": "Committed Git comparison and constrained SQLite records",
      "failure_domain": "A generated nested repository or worker-supplied value cannot define eligibility, rank, or promotion",
      "authority_loss_behavior": "Reject each added Gitlink before a candidate commit; record bounded rejection evidence without gates or quality; do not rewrite that rejection as another candidate disposition; preserve the worktree; continue later candidates; and reject an unknown candidate state, inconsistent quality vector, rank, or promotion decision"
    }
  ],
  "reconciliation": {
    "observation": "Load the current SPEC, Git commit, controller lease, work items, runs, leases, immutable promotion intents, and event history",
    "comparison": "Acquire current controller ownership, reconcile one unresolved promotion intent, then find an eligible desired item that has no current run and remains below its attempt limit",
    "action": "Recover only an exact already-applied promotion under current SPEC authority, or renew controller ownership, create a generation-fenced run, isolate one worktree for product work or a bounded set for self-improvement, execute each agent, reject candidate-local Gitlinks before commit, continue later candidates, evaluate gates only for committed candidates, measure committed candidates against the claimed Git base, rank eligible self-improvement candidates by verified quality vectors, revalidate, store immutable intent, and promote at most one candidate inside the controller-owned operation boundary",
    "repeat_condition": "Repeat while eligible work exists; re-observe after each state change, restart, timeout, or external change"
  },
  "dispatch_revalidation": {
    "boundary": "Immediately before worktree creation and agent dispatch",
    "fresh_read": "Read controller ownership, the SPEC digest, and the base Git commit again and compare them with the current controller and claim",
    "deny_conditions": [
      "Another current controller owns the state database and base repository",
      "The controller owner, repository, generation, or lease time is not current",
      "The SPEC digest changed",
      "The base commit changed",
      "The lease expired",
      "The run generation is not current",
      "The base repository has uncommitted changes",
      "The candidate adds a Gitlink for a nested repository"
    ]
  },
  "retries_timeouts": {
    "retry_policy": "Each child heartbeat revalidates the full SPEC digest and base commit before it renews controller ownership and revalidates the run generation and run lease time; a failed or stale item returns to ready until its configured attempt limit is reached",
    "backoff": "The current local controller retries on a later explicit reconciliation cycle; time-based exponential backoff is not implemented",
    "attempt_limit": 5,
    "timeouts": [
      "The agent process has a configured wall-clock timeout",
      "Each verification gate has a configured wall-clock timeout",
      "Each self-improvement candidate has a configured combined agent-and-gate process-time limit",
      "The controller ownership lease has a configured wall-clock expiration",
      "The run lease has a configured wall-clock expiration"
    ]
  },
  "restart_stale_events": {
    "restart_behavior": "A replacement controller waits for the current ownership lease to expire, acquires a higher controller generation, reconciles unresolved promotion intent against current SPEC and Git, preserves uncertain artifacts, and creates a new run generation only on a later claim",
    "fencing_token": "The controller owner and monotonically increasing controller generation fence scheduling and promotion; the run id and monotonically increasing per-item generation fence run events",
    "stale_event_disposition": "Reject the state change and retain the prior durable event history"
  },
  "preservation_cleanup": [
    {
      "semantic_condition": "The run is executing, evaluating, promoting, recovered, failed, or stale",
      "artifact_action": "Preserve each worktree, bounded artifact-rejection record, candidate commit, gate vector, Git change-surface vector, ranking, promotion intent, decision, and result summary",
      "revalidation": "Read the durable run state before any future cleanup"
    },
    {
      "semantic_condition": "The run succeeded and the promoted commit is reachable from the base branch",
      "artifact_action": "Remove the successful worktree and its merged branch when configured",
      "revalidation": "Confirm terminal success, path containment, clean state, candidate identity, reachability, and Git worktree registration"
    },
    {
      "semantic_condition": "Artifact ownership or semantic disposition is uncertain",
      "artifact_action": "Preserve the artifact",
      "revalidation": "Require new authoritative evidence before changing disposition"
    }
  ],
  "human_handoff": {
    "entry": "Enter handoff when automatic promotion is disabled, policy blocks progress, repeated attempts reach the limit, or an external authority decision is required",
    "stability": "Keep the SPEC, run record, events, candidate worktree, base commit, and failed gate evidence unchanged",
    "resumption": "Change the authoritative SPEC or policy, then run a new reconciliation cycle that creates a new lease generation"
  },
  "states": [
    {
      "name": "ready",
      "classification": "domain",
      "owner": "SQLite projection of the current SPEC",
      "entry": "A current SPEC item is new, changed after achievement, or returned from a failed or stale attempt",
      "exit": "A current generation claims the item, the SPEC removes it, or the attempt limit blocks it",